{
  "metadata": {
    "producer": {
      "version": "0.0.1",
      "name": "dlassalle-by-hand",
      "datetime": "2020-04-30T14:30:00.000000"
    },
    "format": "6.2.0"
  },
  "user_types": {
    "_POOL_TRACKER_BIG_PAGES": {
      "fields": {
        "Va": {
          "offset": 0,
          "type": {
            "kind": "base",
            "name": "unsigned long long"
          }
        },
        "Key": {
          "offset": 8,
          "type": {
            "kind": "base",
            "name": "unsigned long"
          }
        },
        "PoolType": {
          "offset": 12,
          "type": {
            "kind": "base",
            "name": "unsigned long"
          }
        },
        "NumberOfBytes": {
          "offset": 16,
          "type": {
            "kind": "base",
            "name": "unsigned long long"
          }
        }
      },
      "kind": "struct",
      "size": 24
    }
  },
  "symbols": {
  },
  "enums": {
    "_POOL_TYPE": {
      "base": "unsigned long",
      "constants": {
        "NonPagedPoolBase": 0,
        "PagedPool": 1,
        "NonPagedPoolBaseMustSucceed": 2,
        "DontUseThisType": 3,
        "NonPagedPoolBaseCacheAligned": 4,
        "PagedPoolCacheAligned": 5,
        "NonPagedPoolBaseCacheAlignedMustS": 6,
        "MaxPoolType": 7,
        "NonPagedPoolMustSucceedSession": 34,
        "DontUseThisTypeSession": 35,
        "NonPagedPoolSession": 32,
        "NonPagedPoolNx": 512,
        "NonPagedPoolSessionNx": 544,
        "NonPagedPoolNxCacheAligned": 516,
        "PagedPoolSession": 33,
        "NonPagedPoolCacheAlignedMustSSession": 38,
        "PagedPoolCacheAlignedSession": 37,
        "NonPagedPoolCacheAlignedSession": 36
      },
      "size": 4
    }
  },
  "base_types": {
    "unsigned long long": {
      "endian": "little",
      "kind": "int",
      "signed": false,
      "size": 8
    },
    "unsigned long": {
      "endian": "little",
      "kind": "int",
      "signed": false,
      "size": 4
    }
  }
}
